{
  "$defs": {
    "ProjectListItem": {
      "additionalProperties": false,
      "properties": {
        "open": {
          "$ref": "#/$defs/ProjectOpenState"
        },
        "project_scope": {
          "$ref": "#/$defs/ProjectScope"
        },
        "revision": {
          "pattern": "^(?:0|[1-9][0-9]{0,18}|1[0-7][0-9]{18}|18[0-3][0-9]{17}|184[0-3][0-9]{16}|1844[0-5][0-9]{15}|18446[0-6][0-9]{14}|184467[0-3][0-9]{13}|1844674[0-3][0-9]{12}|184467440[0-6][0-9]{10}|1844674407[0-2][0-9]{9}|18446744073[0-6][0-9]{8}|1844674407370[0-8][0-9]{6}|18446744073709[0-4][0-9]{5}|184467440737095[0-4][0-9]{3}|1844674407370955[0-9]{2}|18446744073709551[0-5]|1844674407370955160|1844674407370955161[0-5])$",
          "type": "string"
        },
        "title": {
          "minLength": 1,
          "type": "string",
          "x-storyos-max-utf8-bytes": 1024
        }
      },
      "required": [
        "project_scope",
        "title",
        "revision",
        "open"
      ],
      "type": "object"
    },
    "ProjectOpenState": {
      "oneOf": [
        {
          "additionalProperties": false,
          "properties": {
            "kind": {
              "const": "empty",
              "type": "string"
            }
          },
          "required": [
            "kind"
          ],
          "type": "object"
        },
        {
          "additionalProperties": false,
          "properties": {
            "current_chapter_id": {
              "type": "string"
            },
            "kind": {
              "const": "current_chapter",
              "type": "string"
            }
          },
          "required": [
            "kind",
            "current_chapter_id"
          ],
          "type": "object"
        }
      ]
    },
    "ProjectScope": {
      "additionalProperties": false,
      "properties": {
        "owner_user_id": {
          "format": "uuid",
          "type": "string"
        },
        "project_id": {
          "format": "uuid",
          "type": "string"
        }
      },
      "required": [
        "owner_user_id",
        "project_id"
      ],
      "type": "object"
    }
  },
  "$id": "storyos.query.project-list.response.v1",
  "$schema": "https://json-schema.org/draft/2020-12/schema",
  "additionalProperties": false,
  "properties": {
    "correlation_id": {
      "format": "uuid",
      "type": "string"
    },
    "owner_user_id": {
      "format": "uuid",
      "type": "string"
    },
    "projects": {
      "items": {
        "$ref": "#/$defs/ProjectListItem"
      },
      "type": "array"
    },
    "schema_id": {
      "const": "storyos.query.project-list.response.v1",
      "type": "string"
    }
  },
  "required": [
    "schema_id",
    "correlation_id",
    "owner_user_id",
    "projects"
  ],
  "title": "StoryOS Project List Response",
  "type": "object"
}
