{
  "correlation_id": "018f0000-0000-7001-8000-000000000013",
  "owner_user_id": "018f0000-0000-7001-8000-000000000001",
  "projects": [
    {
      "open": {
        "current_chapter_id": "018f0000-0000-7001-8000-000000000003",
        "kind": "current_chapter"
      },
      "project_scope": {
        "owner_user_id": "018f0000-0000-7001-8000-000000000001",
        "project_id": "018f0000-0000-7001-8000-000000000002"
      },
      "revision": "1",
      "title": "Project A"
    },
    {
      "open": {
        "kind": "empty"
      },
      "project_scope": {
        "owner_user_id": "018f0000-0000-7001-8000-000000000001",
        "project_id": "018f0000-0000-7001-8000-000000000012"
      },
      "revision": "1",
      "title": "Empty Novel"
    }
  ],
  "schema_id": "storyos.query.project-list.response.v1"
}
